{
  "schema": "card_document.v1",
  "card_kind": "season_simulation",
  "document_id": "season-simulation:SEA:20242025",
  "fingerprint": "c8c7e01757c02be05170d5fa2eeeceb8c8bab1fc120e14332d450196e96c73b2",
  "title": "Boreal Ravens 2024-25 IceCast",
  "subtitle": "Baseline · 1000 trials · seed 20262027",
  "context": {
    "view": {
      "window": {
        "season": 20242025,
        "season_type": "regular"
      },
      "generated_at": null,
      "source_state": [],
      "completeness": "complete",
      "data_generation": null
    },
    "evidence_at": null,
    "evidence_label": "simulated",
    "builder_version": "season_simulation_card.v1",
    "methodology_versions": {
      "card_projection": "season_simulation_card.v1",
      "season_forecast": "team_season_forecast.v1"
    },
    "joins": {
      "league_id": null,
      "roster_snapshot_id": null,
      "calendar_fingerprint": null,
      "scoring_scheme_id": null,
      "scenario_id": null,
      "team_ids": [
        "SEA"
      ],
      "player_ids": [],
      "game_ids": [
        "2024020001",
        "2024020002",
        "2024020003",
        "2024020004",
        "2024020005",
        "2024020006",
        "2024020007",
        "2024020008",
        "2024020009",
        "2024020010",
        "2024020011",
        "2024020012",
        "2024020013",
        "2024020014",
        "2024020015",
        "2024020016",
        "2024020017",
        "2024020018",
        "2024020019",
        "2024020020",
        "2024020021",
        "2024020022",
        "2024020023",
        "2024020024",
        "2024020025",
        "2024020026",
        "2024020027",
        "2024020028",
        "2024020030",
        "2024020031",
        "2024020032",
        "2024020033",
        "2024020034",
        "2024020035",
        "2024020036",
        "2024020037",
        "2024020038",
        "2024020039",
        "2024020040",
        "2024020041",
        "2024020042",
        "2024020043",
        "2024020044",
        "2024020045",
        "2024020046",
        "2024020047",
        "2024020048",
        "2024020049",
        "2024020050",
        "2024020051",
        "2024020052",
        "2024020053",
        "2024020054",
        "2024020055",
        "2024020056",
        "2024020057",
        "2024020058",
        "2024020059",
        "2024020060",
        "2024020061",
        "2024020062",
        "2024020063",
        "2024020064",
        "2024020065",
        "2024020066",
        "2024020067",
        "2024020068",
        "2024020069",
        "2024020070",
        "2024020071",
        "2024020072",
        "2024020073",
        "2024020074",
        "2024020075",
        "2024020076",
        "2024020077",
        "2024020078",
        "2024020079",
        "2024020080",
        "2024020081",
        "2024020082",
        "2024020083",
        "2024020084",
        "2024020085",
        "2024020086",
        "2024020087",
        "2024020088",
        "2024020089",
        "2024020090",
        "2024020091",
        "2024020092",
        "2024020093",
        "2024020094",
        "2024020095",
        "2024020096",
        "2024020097",
        "2024020098",
        "2024020099",
        "2024020100",
        "2024020101",
        "2024020102",
        "2024020103",
        "2024020104",
        "2024020105",
        "2024020106",
        "2024020107",
        "2024020108",
        "2024020109",
        "2024020110",
        "2024020111",
        "2024020112",
        "2024020113",
        "2024020114",
        "2024020115",
        "2024020116",
        "2024020117",
        "2024020118",
        "2024020119",
        "2024020120",
        "2024020121",
        "2024020122",
        "2024020123",
        "2024020124",
        "2024020125",
        "2024020126",
        "2024020127",
        "2024020128",
        "2024020129",
        "2024020130",
        "2024020131",
        "2024020132",
        "2024020133",
        "2024020134",
        "2024020135",
        "2024020136",
        "2024020137",
        "2024020138",
        "2024020139",
        "2024020140",
        "2024020141",
        "2024020142",
        "2024020143",
        "2024020144",
        "2024020145",
        "2024020146",
        "2024020147",
        "2024020148",
        "2024020149",
        "2024020150",
        "2024020151",
        "2024020152",
        "2024020153",
        "2024020154",
        "2024020155",
        "2024020156",
        "2024020157",
        "2024020158",
        "2024020159",
        "2024020160",
        "2024020161",
        "2024020162",
        "2024020163",
        "2024020164",
        "2024020165",
        "2024020166",
        "2024020167",
        "2024020168",
        "2024020169",
        "2024020170",
        "2024020171",
        "2024020172",
        "2024020173",
        "2024020174",
        "2024020175",
        "2024020176",
        "2024020177",
        "2024020178",
        "2024020179",
        "2024020180",
        "2024020181",
        "2024020182",
        "2024020183",
        "2024020184",
        "2024020185",
        "2024020186",
        "2024020187",
        "2024020188",
        "2024020189",
        "2024020190",
        "2024020191",
        "2024020192",
        "2024020193",
        "2024020194",
        "2024020195",
        "2024020196",
        "2024020197",
        "2024020198",
        "2024020199",
        "2024020200",
        "2024020201",
        "2024020202",
        "2024020203",
        "2024020204",
        "2024020205",
        "2024020206",
        "2024020207",
        "2024020208",
        "2024020209",
        "2024020210",
        "2024020211",
        "2024020212",
        "2024020213",
        "2024020214",
        "2024020215",
        "2024020216",
        "2024020217",
        "2024020218",
        "2024020219",
        "2024020220",
        "2024020221",
        "2024020222",
        "2024020223",
        "2024020224",
        "2024020225",
        "2024020226",
        "2024020227",
        "2024020228",
        "2024020229",
        "2024020230",
        "2024020231",
        "2024020232",
        "2024020233",
        "2024020234",
        "2024020235",
        "2024020236",
        "2024020237",
        "2024020238",
        "2024020239",
        "2024020240",
        "2024020241",
        "2024020242",
        "2024020243",
        "2024020244",
        "2024020245",
        "2024020246",
        "2024020247",
        "2024020248",
        "2024020249",
        "2024020250",
        "2024020251",
        "2024020252",
        "2024020253",
        "2024020254",
        "2024020255",
        "2024020256",
        "2024020257",
        "2024020258",
        "2024020259",
        "2024020260",
        "2024020261",
        "2024020262",
        "2024020263",
        "2024020264",
        "2024020265",
        "2024020266",
        "2024020267",
        "2024020268",
        "2024020269",
        "2024020270",
        "2024020271",
        "2024020272",
        "2024020273",
        "2024020274",
        "2024020275",
        "2024020276",
        "2024020277",
        "2024020278",
        "2024020279",
        "2024020280",
        "2024020281",
        "2024020282",
        "2024020283",
        "2024020284",
        "2024020285",
        "2024020286",
        "2024020287",
        "2024020288",
        "2024020289",
        "2024020290",
        "2024020291",
        "2024020292",
        "2024020293",
        "2024020294",
        "2024020295",
        "2024020296",
        "2024020297",
        "2024020298",
        "2024020299",
        "2024020300",
        "2024020301",
        "2024020302",
        "2024020303",
        "2024020304",
        "2024020305",
        "2024020306",
        "2024020307",
        "2024020308",
        "2024020309",
        "2024020310",
        "2024020311",
        "2024020312",
        "2024020313",
        "2024020314",
        "2024020315",
        "2024020316",
        "2024020317",
        "2024020318",
        "2024020319",
        "2024020320",
        "2024020321",
        "2024020322",
        "2024020323",
        "2024020324",
        "2024020325",
        "2024020326",
        "2024020327",
        "2024020328",
        "2024020329",
        "2024020330",
        "2024020331",
        "2024020332",
        "2024020333",
        "2024020334",
        "2024020335",
        "2024020336",
        "2024020337",
        "2024020338",
        "2024020339",
        "2024020340",
        "2024020341",
        "2024020342",
        "2024020343",
        "2024020344",
        "2024020345",
        "2024020346",
        "2024020347",
        "2024020348",
        "2024020349",
        "2024020350",
        "2024020351",
        "2024020352",
        "2024020353",
        "2024020354",
        "2024020355",
        "2024020356",
        "2024020357",
        "2024020358",
        "2024020359",
        "2024020360",
        "2024020361",
        "2024020362",
        "2024020363",
        "2024020364",
        "2024020365",
        "2024020366",
        "2024020367",
        "2024020368",
        "2024020369",
        "2024020370",
        "2024020371",
        "2024020372",
        "2024020373",
        "2024020374",
        "2024020375",
        "2024020376",
        "2024020377",
        "2024020378",
        "2024020379",
        "2024020380",
        "2024020381",
        "2024020382",
        "2024020383",
        "2024020384",
        "2024020385",
        "2024020386",
        "2024020387",
        "2024020388",
        "2024020389",
        "2024020390",
        "2024020391",
        "2024020392",
        "2024020393",
        "2024020394",
        "2024020395",
        "2024020396",
        "2024020397",
        "2024020398",
        "2024020399",
        "2024020400",
        "2024020401",
        "2024020402",
        "2024020403",
        "2024020404",
        "2024020405",
        "2024020406",
        "2024020407",